Subject,StartDate,EndDate,Status,Progress,DurationSec,Finished,RecordedDate,ResponseId,RecipientLastName,RecipientFirstName,RecipientEmail,ExternalReference,LocationLatitude,LocationLongitude,DistributionChannel,UserLanguage,instructions1,trick,V1_FirstClick,V1_LastClick,V1_PageSubmit,V1_ClickCount,V1_r,V1_c,V2_FirstClick,V2_LastClick,V2_PageSubmit,V2_ClickCount,V2_r,V2_c,V3_FirstClick,V3_LastClick,V3_PageSubmit,V3_ClickCount,V3_r,V3_c,V4_FirstClick,V4_LastClick,V4_PageSubmit,V4ClickCount,V4_r,V4_c,Open,GL1,GL2,GL3,GL4,GL5,GL6,GL7,GL8,GL9,GL10,GL11,GL12,GL13,Ed,Gender,Gender_5_TEXT,Age
,Start Date,End Date,Response Type,Progress,Duration (in seconds),Finished,Recorded Date,Response ID,Recipient Last Name,Recipient First Name,Recipient Email,External Data Reference,Location Latitude,Location Longitude,Distribution Channel,User Language,"Instructions:
Please read the following instructions carefully. On the next page, you will be asked a question about the information in these instructions. Incorrect responses will result in the survey exiting, and you will not receive a payment code for Mechanical Turk.

 
Task:

You will look at graphs like the one below and then answer questions about them. These graphs will show trends over time in different cities. Each graph shows a trend for a different city.​

 



 
 

 
 

Based on these trends, you will be asked: ""What can you say about the situation in this city?"" You will click inside one of the boxes to select your preferred judgment.","Complete the sentence with the appropriate 7 letter word:  


During this study, it is important that you make your judgments as  _ _ _ _ _ _ _ and accurately as possible.  

 

Please enter your response in the text box using only lower case letters.",Timing - First Click,Timing - Last Click,Timing - Page Submit,Timing - Click Count,"​




What can you say about the situation in Tilson?",How confident are you in your response?,Timing - First Click,Timing - Last Click,Timing - Page Submit,Timing - Click Count,"​




What can you say about the situation in Bayton?",How confident are you in your response?,Timing - First Click,Timing - Last Click,Timing - Page Submit,Timing - Click Count,"​




What can you say about the situation in Torley?",How confident are you in your response?,Timing - First Click,Timing - Last Click,Timing - Page Submit,Timing - Click Count,"​




What can you say about the situation in Darson?",How confident are you in your response?,We are very interested in how you made your decisions. Please list all the things you considered when making your judgments.,"Here is some information about cancer therapies.
​

What percentage of patients recovered after chemotherapy?",What is the difference between the percentage of patients who recovered after a surgery and the percentage of patients who recovered after radiation therapy?,"​Here is some information about different forms of cancer.




Of all the people who die from cancer, approximately what percentage dies from lung cancer?","Approximately what percentage of people who die from cancer die from colon cancer, breast cancer, and prostate cancer taken together?","Here is some information about an imaginary disease called Adeolitis.



Approximately what percentage of people had Adeolitis in the year 2000?",When was the increase in the percentage of people with Adeolitis higher?,"According to your best guess, what will the percentage of people with Adeolitis be in the year 2010?","​The following figure shows the number of men and women among the patients with disease X. The total number of circles is 100. 


​

Of the 100 patients with disease X, how many are women?",How many more men than women are there among the 100 patients with disease X?,"In a magazine, you see two advertisements, one on page 5 and another on page 12. Each is for a different drug for treating heart disease, and each includes a graph showing the effectiveness of the drug compared to a placebo (sugar pill).
​



Compared to the placebo, which treatment leads to a larger decrease in the percentage of patients who die?","In the newspaper, you see two advertisements, one on page 15 and another on page 17. Each is for a different treatment of psoriasis, and each includes a graph showing the effectiveness of the treatment over time.
​


Which of the treatments contributes to a larger decrease in the percentage of sick patients?","Here is some information about the imaginary diseases Coliosis and Tiosis.




Between 1980 and 1990, which disease had a higher increase in the percentage of people affected?","Here is some information about cancer therapies.  

What is the percentage of the cancer patients who die after chemotherapy?",What is the highest level of school you have completed or the highest degree you have received?,What is your gender? - Selected Choice,What is your gender? - Prefer to self-describe - Text,What is your age?
,"{""ImportId"":""startDate"",""timeZone"":""America/Denver""}","{""ImportId"":""endDate"",""timeZone"":""America/Denver""}","{""ImportId"":""status""}","{""ImportId"":""progress""}","{""ImportId"":""duration""}","{""ImportId"":""finished""}","{""ImportId"":""recordedDate"",""timeZone"":""America/Denver""}","{""ImportId"":""_recordId""}","{""ImportId"":""recipientLastName""}","{""ImportId"":""recipientFirstName""}","{""ImportId"":""recipientEmail""}","{""ImportId"":""externalDataReference""}","{""ImportId"":""locationLatitude""}","{""ImportId"":""locationLongitude""}","{""ImportId"":""distributionChannel""}","{""ImportId"":""userLanguage""}","{""ImportId"":""QID5""}","{""ImportId"":""QID7_TEXT""}","{""ImportId"":""QID458_FIRST_CLICK""}","{""ImportId"":""QID458_LAST_CLICK""}","{""ImportId"":""QID458_PAGE_SUBMIT""}","{""ImportId"":""QID458_CLICK_COUNT""}","{""ImportId"":""QID320""}","{""ImportId"":""QID460""}","{""ImportId"":""QID463_FIRST_CLICK""}","{""ImportId"":""QID463_LAST_CLICK""}","{""ImportId"":""QID463_PAGE_SUBMIT""}","{""ImportId"":""QID463_CLICK_COUNT""}","{""ImportId"":""QID464""}","{""ImportId"":""QID465""}","{""ImportId"":""QID467_FIRST_CLICK""}","{""ImportId"":""QID467_LAST_CLICK""}","{""ImportId"":""QID467_PAGE_SUBMIT""}","{""ImportId"":""QID467_CLICK_COUNT""}","{""ImportId"":""QID468""}","{""ImportId"":""QID469""}","{""ImportId"":""QID471_FIRST_CLICK""}","{""ImportId"":""QID471_LAST_CLICK""}","{""ImportId"":""QID471_PAGE_SUBMIT""}","{""ImportId"":""QID471_CLICK_COUNT""}","{""ImportId"":""QID472""}","{""ImportId"":""QID473""}","{""ImportId"":""QID213_TEXT""}","{""ImportId"":""QID277_TEXT""}","{""ImportId"":""QID278_TEXT""}","{""ImportId"":""QID279_TEXT""}","{""ImportId"":""QID280_TEXT""}","{""ImportId"":""QID281_TEXT""}","{""ImportId"":""QID282""}","{""ImportId"":""QID283_TEXT""}","{""ImportId"":""QID284_TEXT""}","{""ImportId"":""QID285_TEXT""}","{""ImportId"":""QID286""}","{""ImportId"":""QID287""}","{""ImportId"":""QID288""}","{""ImportId"":""QID289_TEXT""}","{""ImportId"":""QID249""}","{""ImportId"":""QID253""}","{""ImportId"":""QID253_5_TEXT""}","{""ImportId"":""QID275_TEXT""}"
252,05/04/2019 21:48,05/04/2019 21:55,IP Address,100,438,TRUE,05/04/2019 21:55,R_b7Y1ZtrKPxqyVyh,,,,,40.67500305,-73.67310333,anonymous,EN,Declining,quickly,0,0,2.764,0,Declining,4,14.842,14.842,16.274,1,Declining,3,6.227,11.335,14.583,2,Improving,4,4.756,4.756,5.503,1,Improving,4,"I considered both the direction of the line on the graph and the layout of the numbers, as well as the context of the topic (i.e. for a subject like the number of murders in a city, a lower number is better)",35,15,25,25,20,Increase was the same in both intervals,25,40,20,They are equal,Can’t say,Tiosis,50,Bachelor's degree in college (4-year),Female,,36
253,05/04/2019 22:35,05/04/2019 22:40,IP Address,100,326,TRUE,05/04/2019 22:40,R_ZBF5j5lqKHz6PLj,,,,,41.28540039,-96.1493988,anonymous,EN,Declining,quickly,0,0,1.599,0,Improving,5 (very confident),7.743,7.743,10.449,1,Declining,5 (very confident),2.136,2.136,4.571,1,Declining,5 (very confident),3.165,4.238,5.735,2,Improving,5 (very confident),"I assumed that more vacation days was better, and fewer murders was better.",35,15,25,25,20,Increase was the same in both intervals,25,40,20,They are equal,Can’t say,Tiosis,5,Master's degree,Male,,39
254,05/04/2019 22:32,05/04/2019 22:46,IP Address,100,852,TRUE,05/04/2019 22:46,R_1I58JJm0NrR0gVq,,,,,13.08430481,80.28048706,anonymous,EN,Improving,quickly,0,0,7.009,0,Improving,4,1.308,1.308,2.523,1,Improving,4,5.211,5.211,7.421,1,Improving,5 (very confident),1.537,1.537,2.689,1,Improving,4,"Focusing on the symptoms instead of the problem
Having no clear picture of the desired outcome
Becoming fixated on only one option
Making decisions that do not align with the overall goals of the organization
Missing opportunities to set decision criteria
Failing to evaluate enacted decisions",45,5,40,30,20,From 2000 to 2005,24,80,80,They are equal,They are equal,The increase was equal,5,Bachelor's degree in college (4-year),Female,,24
255,05/04/2019 22:47,05/04/2019 22:51,IP Address,100,282,TRUE,05/04/2019 22:51,R_3NOt2kqEF21Qxh4,,,,,37.5625,-122.0003967,anonymous,EN,Improving,quickly,0,0,1.349,0,Declining,4,5.939,5.939,7.023,1,Declining,3,1.532,1.532,3.475,1,Declining,4,3.828,17.716,19.902,3,Improving,4,if the graph is going up or down and what the situation is,35,5,25,25,20,Increase was the same in both intervals,25,40,60,Hertinol,Nopsorian,Coliosis,5,Bachelor's degree in college (4-year),Male,,27
256,05/04/2019 22:53,05/04/2019 22:59,IP Address,100,364,TRUE,05/04/2019 22:59,R_3MoEkELYqP0Mn6G,,,,,9.966705322,76.23330688,anonymous,EN,Improving,quickly,0,0,167.797,0,Improving,4,1.059,1.059,1.965,1,Improving,4,3.082,3.082,3.875,1,Improving,4,2.931,2.931,4.781,1,Improving,4,"Making decisions that do not align with the overall goals of the organization
Missing opportunities to set decision criteria
Failing to evaluate enacted decisions",35,30,25,10,20,Increase was the same in both intervals,25,80,80,They are equal,They are equal,The increase was equal,5,Bachelor's degree in college (4-year),Male,,25
257,05/04/2019 22:55,05/04/2019 23:06,IP Address,100,646,TRUE,05/04/2019 23:06,R_vT8yP15J3G8nwxr,,,,,37.81069946,-122.2478943,anonymous,EN,Declining,quickly,0,0,1.33,0,Declining,4,2.568,2.568,8.426,1,Improving,4,2.9,2.9,4.713,1,Improving,5 (very confident),1.822,1.822,4.769,1,Declining,5 (very confident),Whether the things that were increasing/decreasing were beneficial or harmful,35,10,25,25,20,Increase was the same in both intervals,25,40,60,Crosicol,Nopsorian,Tiosis,5,High school graduate (high school diploma or equivalent including GED),Male,,38
258,05/04/2019 23:12,05/04/2019 23:14,IP Address,100,141,TRUE,05/04/2019 23:14,R_WBTEPJeBSf6gxk5,,,,,9.966705322,76.23330688,anonymous,EN,Improving,quickly,0,0,2.817,0,Improving,4,1.62,1.62,2.252,1,Improving,5 (very confident),3.934,3.934,4.578,1,Improving,4,1.24,12.368,12.766,2,Improving,5 (very confident),Identify the decision. The first step in making the right decision is recognizing the problem or opportunity and deciding to address it. Determine why this decision will make a difference to your customers or fellow employees.,35,30,20,10,20,Increase was the same in both intervals,25,80,80,They are equal,They are equal,The increase was equal,5,Bachelor's degree in college (4-year),Male,,24
259,05/04/2019 23:00,05/04/2019 23:15,IP Address,100,873,TRUE,05/04/2019 23:15,R_1F9QQ7KDgniRozY,,,,,13.08430481,80.28048706,anonymous,EN,,quickly,0.737,0.737,1.593,1,Improving,4,0.917,1.373,1.918,2,Improving,4,1.172,1.98,2.7,3,Improving,3,528.617,529.096,529.915,2,Improving,4,identifing,35,30,25,10,20,From 2000 to 2005,25,80,80,Hertinol,They are equal,The increase was equal,5,Bachelor's degree in college (4-year),Male,,24
260,05/04/2019 23:22,05/04/2019 23:27,IP Address,100,253,TRUE,05/04/2019 23:27,R_pKR0qRoxrUj9XGx,,,,,13.08430481,80.28048706,anonymous,EN,Improving,quickly,0,0,1.686,0,Improving,4,1.334,1.334,2.406,1,Improving,4,2.769,2.769,3.69,1,Improving,4,2.319,2.319,3.456,1,Improving,4,Verifying your understanding of the problems,35,15,25,25,20,From 2000 to 2005,25,80,80,They are equal,They are equal,The increase was equal,5,Bachelor's degree in college (4-year),Male,,38
261,05/04/2019 23:18,05/04/2019 23:27,IP Address,100,552,TRUE,05/04/2019 23:27,R_3nMo4KrLlU7OEcM,,,,,44.99479675,-93.25479889,anonymous,EN,Improving,quickly,0,0,1.304,0,Improving,5 (very confident),4.642,13.718,14.976,6,Declining,5 (very confident),1.324,8.711,9.387,5,Declining,5 (very confident),2.11,7.219,9.025,7,Improving,5 (very confident),"Weather the numbers were inclining or declining, and if this was a good or bad thing effecting the town.",35,15,25,25,20,Increase was the same in both intervals,25,40,20,They are equal,Nopsorian,Tiosis,5,Associate degree in college (2-year),Female,,43
262,05/04/2019 23:36,05/04/2019 23:39,IP Address,100,219,TRUE,05/04/2019 23:39,R_C97vHFW9WjsCEY9,,,,,13.08430481,80.28048706,anonymous,EN,Improving,quickly,0,0,1.003,0,Improving,4,1.907,1.907,3.258,1,Improving,4,4.759,4.759,5.81,1,Improving,4,1.887,1.887,2.968,1,Improving,4,Prioritize the problems,35,10,25,25,20,From 2000 to 2005,25,80,80,They are equal,They are equal,The increase was equal,5,Bachelor's degree in college (4-year),Male,,27
263,06/04/2019 01:06,06/04/2019 01:21,IP Address,100,890,TRUE,06/04/2019 01:21,R_3q9X5vDtbUnzhRO,,,,,37.01899719,-86.4536972,anonymous,EN,Improving,quickly,0,0,6.025,0,Improving,5 (very confident),20.439,23.286,25.384,2,Improving,4,5.273,6.455,7.621,2,Improving,5 (very confident),11.352,12.301,13.517,2,Declining,4,Just read the graph,35,45,25,25,20,From 2000 to 2005,25,40,20,Crosicol,Nopsorian,Tiosis,5,High school graduate (high school diploma or equivalent including GED),Female,,33
264,06/04/2019 01:50,06/04/2019 01:56,IP Address,100,379,TRUE,06/04/2019 01:56,R_2P1qvlbgj6zzdQp,,,,,35.14889526,136.9014893,anonymous,EN,Declining,quickly,0,0,2.001,0,Declining,5 (very confident),1.453,2.953,4.501,2,Improving,5 (very confident),2.496,4.471,5.999,3,Improving,3,1.515,4.294,6.178,2,Improving,3,I was unsure of the murders on as it is negative when numbers go up and positive when they go down.,35,15,25,25,20,Increase was the same in both intervals,25,40,60,They are equal,Nopsorian,Tiosis,50,Bachelor's degree in college (4-year),Female,,32
265,06/04/2019 03:48,06/04/2019 03:54,IP Address,100,340,TRUE,06/04/2019 03:54,R_3KwwL6Q0mK65j4B,,,,,40.70530701,-74.08660126,anonymous,EN,Declining,quickly,0,0,1.615,0,Declining,5 (very confident),2.213,2.213,3.64,1,Improving,5 (very confident),1.497,1.497,2.652,1,Declining,4,4.776,4.776,9.318,1,Improving,3,I observed the slope of the line on the graph and then I considered the what the graph was measuring.,35,5,25,25,20,Increase was the same in both intervals,25,40,20,They are equal,Can’t say,Tiosis,5,Bachelor's degree in college (4-year),Male,,34
266,06/04/2019 05:37,06/04/2019 05:45,IP Address,100,497,TRUE,06/04/2019 05:45,R_3O2hzdKJqWlrL0h,,,,,42.64289856,-83.354599,anonymous,EN,Improving,quickly,0,0,1.248,0,Improving,4,14.759,14.759,15.69,1,Declining,3,15.145,15.145,17.221,1,Declining,3,4.284,4.284,5.362,1,Improving,4,"Direction of graph, vagaries of the questions.  ",35,10,25,25,20,From 2000 to 2005,22,40,20,Hertinol,Nopsorian,Tiosis,7,Bachelor's degree in college (4-year),Male,,51
267,06/04/2019 06:06,06/04/2019 06:15,IP Address,100,540,TRUE,06/04/2019 06:15,R_1CDA4wx2eFNvwz7,,,,,41.12600708,-78.75270081,anonymous,EN,Improving,quickly,0,0,3.78,0,Improving,5 (very confident),7.023,7.023,8.642,1,Declining,5 (very confident),6.677,6.677,9.213,1,Improving,5 (very confident),7.595,7.595,10.103,1,Declining,5 (very confident),I paid attention to the direction the graph was going (left or right) which showed me whether the situation was improving or worsening.  ,35,15,25,25,20,Increase was the same in both intervals,25,40,20,They are equal,They are equal,Tiosis,5,Bachelor's degree in college (4-year),Female,,53
268,06/04/2019 06:25,06/04/2019 06:35,IP Address,100,587,TRUE,06/04/2019 06:35,R_REbm9uSjFI1Ux9v,,,,,40.00860596,-74.78959656,anonymous,EN,Improving,quickly,0,0,2.39,0,Improving,5 (very confident),9.242,9.242,11.072,1,Declining,5 (very confident),7.641,7.641,8.911,1,Improving,5 (very confident),5.922,5.922,7.489,1,Declining,5 (very confident),I used the graph to see if the numbers went up or down over time.,35,5,25,25,20,From 2000 to 2005,27,40,20,They are equal,Nopsorian,Tiosis,5,Master's degree,Female,,68
269,06/04/2019 07:07,06/04/2019 07:13,IP Address,100,333,TRUE,06/04/2019 07:13,R_2arvSpruk0x1UjN,,,,,42.33940125,-122.8475037,anonymous,EN,Declining,quickly,2.83,2.83,3.428,1,Declining,5 (very confident),0.9,3.191,3.832,4,Improving,5 (very confident),1.128,5.144,6.434,5,Improving,5 (very confident),0.823,3.758,4.763,4,Declining,5 (very confident),"We are talking about vacation days and murders so basically if the number of vacation days is going down things are getting worse, if up improving. For murders it is the opposite.",35,15,25,25,20,Increase was the same in both intervals,25,40,20,They are equal,Nopsorian,Tiosis,5,Bachelor's degree in college (4-year),Male,,43
270,06/04/2019 07:10,06/04/2019 07:25,IP Address,100,861,TRUE,06/04/2019 07:25,R_PYDzgKhvdBHLf7r,,,,,33.56309509,-117.2738037,anonymous,EN,Improving,quickly,0,0,2.898,0,Improving,5 (very confident),8.793,8.793,10.924,1,Declining,5 (very confident),13.985,13.985,15.942,1,Improving,5 (very confident),8.468,8.468,10.995,1,Declining,5 (very confident),"If the chart showed an increase, I chose ""improving."" If it showed a decrease, I chose ""declining.""",35,15,25,25,20,From 2000 to 2005,25,40,60,Crosicol,Nopsorian,Tiosis,5,Associate degree in college (2-year),Female,,59
271,06/04/2019 08:15,06/04/2019 08:22,IP Address,100,428,TRUE,06/04/2019 08:22,R_3M4dEm1iUqf35oT,,,,,30.27909851,-89.76789856,anonymous,EN,Declining,quickly,0,0,1.554,0,Declining,5 (very confident),2.117,2.117,3.227,1,Improving,5 (very confident),2.149,2.149,3.325,1,Improving,5 (very confident),2.134,3.75,5.771,2,Declining,4,I considered what the graph was representing. Based on that I decided whether the situation was improving or declining.,35,15,25,25,20,From 1975 to 1980,25,40,60,Crosicol,Nopsorian,Tiosis,5,Some college but no degree,Female,,34
272,06/04/2019 08:25,06/04/2019 08:49,IP Address,100,1387,TRUE,06/04/2019 08:49,R_2WwN2vwttg4MHCW,,,,,40.96369934,-81.4210968,anonymous,EN,Improving,quickly,0,0,133.131,0,Improving,5 (very confident),3.966,6.365,6.977,3,Declining,5 (very confident),2.022,4.101,4.9,2,Declining,5 (very confident),7.292,8.551,9.941,2,Improving,5 (very confident),I considered whether the numbers were going up or down and if it was good or bad,35,15,25,25,20,From 2000 to 2005,25,40,20,Crosicol,Nopsorian,Tiosis,40,Some college but no degree,Female,,50
273,06/04/2019 09:05,06/04/2019 09:10,IP Address,100,313,TRUE,06/04/2019 09:10,R_1giLahtjGTY0Neu,,,,,42.73550415,-89.04049683,anonymous,EN,Neither declining or improving,quickly,0,0,1.821,0,Improving,5 (very confident),3.301,3.301,5.513,1,Improving,4,3.306,3.306,5.81,1,Improving,1 (not at all confident),5.697,5.697,10.367,1,Improving,5 (very confident),"I considered if there were more or fewer murders as time progressed, or more or less vacation days as time progressed. Some of the graphs were very misleading, however.",35,10,25,25,20,Increase was the same in both intervals,24,40,20,Crosicol,Can’t say,Tiosis,50,Master's degree,Female,,36
274,06/04/2019 09:23,06/04/2019 09:27,IP Address,100,233,TRUE,06/04/2019 09:27,R_12ciTZvmNzFUqc5,,,,,37.01899719,-86.4536972,anonymous,EN,Declining,quickley,0,0,0.694,0,Declining,5 (very confident),3.903,3.903,4.512,1,Improving,5 (very confident),1.581,1.581,1.814,1,Improving,5 (very confident),4.528,4.815,5.406,2,Declining,5 (very confident),Just looking at the graph,35,15,25,25,20,Increase was the same in both intervals,25,40,20,They are equal,Nopsorian,Tiosis,5,Bachelor's degree in college (4-year),Male,,29
275,06/04/2019 10:40,06/04/2019 10:53,IP Address,100,769,TRUE,06/04/2019 10:53,R_BRlGD0rJninj0LD,,,,,9.449996948,77.81671143,anonymous,EN,Improving,quickly,0,0,2.87,0,Improving,5 (very confident),6.898,6.898,11.383,1,Declining,5 (very confident),11.716,11.716,15.724,1,Improving,5 (very confident),17.084,17.084,18.505,1,Declining,5 (very confident),I just look in to the X axis data and the line drawn and make my decision.,70,30,25,25,67,Increase was the same in both intervals,83,40,60,Crosicol,Apsoriatin,Tiosis,50,Master's degree,Male,,36
276,06/04/2019 11:43,06/04/2019 11:51,IP Address,100,474,TRUE,06/04/2019 11:51,R_2BsUpAlpYPZvuLa,,,,,40.78570557,-111.9291,anonymous,EN,,quickly,5.829,5.829,6.707,1,Improving,5 (very confident),5.696,5.696,7.356,1,Declining,4,13.019,13.019,15.34,1,Declining,4,4.78,6.426,7.104,2,Improving,5 (very confident),"Well, I am not sure if I answered the way you wanted, i.e., with the number of murders one -- I went under the assumption that if the murder rate rose that would indicate a decline",35,15,25,25,20,From 2000 to 2005,25,40,60,Hertinol,Nopsorian,Coliosis,5,Associate degree in college (2-year),Female,,61
277,06/04/2019 12:55,06/04/2019 13:02,IP Address,100,412,TRUE,06/04/2019 13:02,R_1mruhcem0cgPuDz,,,,,33.78379822,-84.44550323,anonymous,EN,Improving,quickly,0,0,2.084,0,Improving,5 (very confident),10.314,10.314,14.24,1,Declining,5 (very confident),10.319,27.62,28.765,3,Improving,3,12.133,12.133,13.694,1,Declining,5 (very confident),I just read a graph like I normally would. Only thing that was off/confusing was the x axis is in reverse order compared to a normal graph. ,35,10,25,25,20,Increase was the same in both intervals,25,40,10,Crosicol,Nopsorian,Tiosis,50,Master's degree,Male,,31
278,06/04/2019 13:24,06/04/2019 13:39,IP Address,100,867,TRUE,06/04/2019 13:39,R_1doYZYYMORGXD1g,,,,,37.2868042,-82.87409973,anonymous,EN,Declining,quickly ,0,0,2.545,0,Improving,5 (very confident),12.269,12.269,13.715,1,Declining,5 (very confident),4.684,24.808,25.567,2,Declining,3,5.416,5.416,9.832,1,Improving,4,Graph info only.,35,15,25,25,20,Increase was the same in both intervals,25,40,20,They are equal,Can’t say,Tiosis,5,Associate degree in college (2-year),Male,,28
279,06/04/2019 14:26,06/04/2019 14:48,IP Address,100,1331,TRUE,06/04/2019 14:48,R_wUboxt4XNhoxDUt,,,,,27.77619934,-97.42710114,anonymous,EN,Improving,quickly,0,0,3.841,0,Improving,5 (very confident),9.759,9.759,10.621,1,Declining,5 (very confident),22.653,22.653,25.537,1,Improving,4,7.231,7.231,12.589,1,Improving,5 (very confident),"I look at the years in the graph and move my eyes in the direction the years are listed. I also look at the thing being measured and adjust my thinking accordingly--a word like ""murder"" with a larger number value is not ""improving"".",35,15,25,25,20,Increase was the same in both intervals,24,40,20,They are equal,Can’t say,Tiosis,5,Bachelor's degree in college (4-year),Male,,64
280,06/04/2019 14:49,06/04/2019 14:56,IP Address,100,452,TRUE,06/04/2019 14:56,R_3MJrotip3Yocnh6,,,,,42.07020569,-72.62270355,anonymous,EN,Improving,quickly,0,0,3.153,0,Improving,5 (very confident),5.135,5.135,7.258,1,Declining,5 (very confident),6.513,6.513,9.922,1,Improving,3,5.946,5.946,9.571,1,Declining,5 (very confident),I just looked at the graph and the numbers.,70,20,25,25,7,Increase was the same in both intervals,25,40,10,Hertinol,Nopsorian,Tiosis,5,Master's degree,Female,,57
281,06/04/2019 15:42,06/04/2019 15:50,IP Address,100,501,TRUE,06/04/2019 15:50,R_2B9xq1w6sPNLGqj,,,,,30.54780579,-96.27149963,anonymous,EN,,quickly,0,0,5.156,0,Improving,5 (very confident),3.533,6.086,6.913,4,Declining,5 (very confident),1.799,3.739,5.374,3,Improving,5 (very confident),3.368,6.784,7.543,4,Improving,5 (very confident),I just looked at if there was more or less of the subject over time.,35,5,25,25,20,From 2000 to 2005,25,40,20,They are equal,Nopsorian,Tiosis,50,High school graduate (high school diploma or equivalent including GED),Female,,65
282,06/04/2019 17:14,06/04/2019 17:26,IP Address,100,684,TRUE,06/04/2019 17:26,R_OeVxArsT7fzyanD,,,,,36.12199402,-115.0859985,anonymous,EN,Improving,quickly,0,0,4.084,0,Improving,5 (very confident),4.229,4.229,6.227,1,Declining,5 (very confident),9.175,9.175,11.651,1,Declining,5 (very confident),7.79,7.79,12.62,1,Improving,5 (very confident),"If the graph was showing data for something positive (vacations) or negative (murders).  If it was something positive and the numbers were increasing, I considered this as improving.  If it was something negative and increasing, I saw this as declining.",35,15,25,25,20,Increase was the same in both intervals,24,40,20,They are equal,Can’t say,Tiosis,5,Some college but no degree,Male,,46
283,06/04/2019 18:48,06/04/2019 18:53,IP Address,100,317,TRUE,06/04/2019 18:53,R_XtUthOesYJTaS09,,,,,39.89489746,-76.14649963,anonymous,EN,Improving,quickly,0,0,1.094,0,Improving,5 (very confident),5.101,5.101,5.896,2,Declining,5 (very confident),6.401,6.548,7.699,2,Declining,4,7.683,7.695,9.189,2,Improving,3,I read the graphs to make my judgements.,36,15,25,25,20,Increase was the same in both intervals,25,40,20,They are equal,Nopsorian,Tiosis,5,High school graduate (high school diploma or equivalent including GED),Female,,37
284,06/04/2019 20:02,06/04/2019 20:08,IP Address,100,368,TRUE,06/04/2019 20:08,R_2QSA518JTZnWdJn,,,,,36.23930359,-78.90190125,anonymous,EN,Improving,quickly,1.23,1.23,2.336,1,Improving,4,3.6,3.6,4.595,1,Declining,4,3.776,3.776,4.981,1,Declining,5 (very confident),4.579,4.579,5.806,1,Improving,5 (very confident),"With vacation days I saw more vacation days and improving and less as declining. With murders, more was declining and less was improving.",35,15,25,12,20,From 2000 to 2005,25,40,60,Crosicol,Nopsorian,Tiosis,50,High school graduate (high school diploma or equivalent including GED),Female,,39
